date,component_id,maintenance_type,description,hobbs_at_service,tach_at_service,next_due_hobbs,next_due_tach,next_due_date,mechanic,inspector,ad_reference,sb_reference,squawk_id,resolved_by,parts_replaced,labor_hours,signoff_type,severity,status
2025-09-23,N1156P,annual,Annual inspection completed. Minor squawks noted. ELT battery replaced. Aircraft returned to service.,5282.3,4859.7,,,2026-09-23,"Desert Aero Maintenance — James Wheeler, A&P/IA #2918473","James Wheeler, IA #2918473",AD 80-04-03 R2; AD 2011-10-09; AD 90-06-03 R1,SB 480F,,,ELT battery; spark plugs rotated; oil and filter changed,10.0,inspection_approval,,
2025-09-28,N1156P-ENGINE,oil_change,Oil change concurrent with annual. Cut filter clean. No anomalies.,5282.3,4859.7,,4909.7,,"Desert Aero Maintenance — James Wheeler, A&P/IA #2918473",,,SB 388C,,,Oil filter; 7 qts Aeroshell 15W-50,1.0,return_to_service,,
2026-02-13,N1156P-ENGINE,oil_change,50-hour oil change. OVERDUE — 53.2 hours since last change. Pilot reported oil consumption has increased. Cut filter shows elevated fine metallic particles. RECOMMEND BORESCOPE AND OIL ANALYSIS BEFORE NEXT FLIGHT. Blackstone sample sent.,5385.5,4954.7,,5004.7,,"Desert Aero Maintenance — James Wheeler, A&P/IA #2918473",,,SB 388C,,,Oil filter; 7 qts Aeroshell 15W-50,1.5,return_to_service,,
2026-04-25,N1156P-ENGINE,post_accident_inspection,"Post-accident teardown inspection following catastrophic engine failure on 2026-03-13. Cylinder #2 connecting rod failed and exited through case. Evidence of chronic lean detonation found: piston crown erosion, cylinder head erosion consistent with detonation, valve face pitting. Engine is NOT REPAIRABLE. Replacement required.",5435.5,4995.5,,,,"AZ Aviation Overhaul — Linda Chen, A&P/IA #3561028","Linda Chen, IA #3561028",AD 2011-10-09,,SQ-N1156P-001,,,24.0,conformity_statement,,
2026-03-13,N1156P-ENGINE,squawk,"CATASTROPHIC ENGINE FAILURE. Connecting rod failure, rod exited through case. Aircraft made emergency off-airport landing. Aircraft NOT AIRWORTHY. Engine requires replacement.",5435.5,4995.5,,,,"AZ Aviation Overhaul — Linda Chen, A&P/IA #3561028","Linda Chen, IA #3561028",AD 2011-10-09,,SQ-N1156P-001,,,2.0,,grounding,open
